{
  "firstName": "John",
  "lastName": "Doe",
  "age": 21,
  "latitude": 48.858093,
  "longitude": 2.294694,
  "fruits": [
    "apple",
    "orange",
    "pear"
  ],
  "numbers": [
    1,
    2,
    3,
    4,
    5,
    6,
    7,
    8,
    9,
    10
  ],
  "vegetables": [
    {
      "veggieName": "potato",
      "veggieLike": true
    },
    {
      "veggieName": "broccoli",
      "veggieLike": false
    },
    {
      "veggieName": "broccoli",
      "veggieLike": false
    }
  ]
}